{
  "schemaVersion": 1,
  "releaseId": "mira-poc-2026-09",
  "required": [
    "./index.html",
    "./manifest.webmanifest",
    "./service-worker.js",
    "./styles/app.css",
    "./vendor/leaflet/leaflet.js",
    "./vendor/leaflet/leaflet.css",
    "./vendor/leaflet/images/marker-icon.png",
    "./vendor/leaflet/images/marker-icon-2x.png",
    "./vendor/leaflet/images/marker-shadow.png",
    "./js/main.js",
    "./js/core/answer-normalizer.js",
    "./js/core/bgm-flow.js",
    "./js/core/content-validator.js",
    "./js/core/conversation-log.js",
    "./js/core/debug-progress.js",
    "./js/core/dialogue-flow.js",
    "./js/core/game-state.js",
    "./js/core/runtime-mode.js",
    "./js/core/route-geometry.js",
    "./js/core/state-machine.js",
    "./js/services/asset-preloader.js",
    "./js/services/audio-queue.js",
    "./js/services/bgm-player.js",
    "./js/services/location.js",
    "./js/services/offline-control.js",
    "./js/services/storage.js",
    "./js/ui/map-view.js",
    "./js/ui/call-island.js",
    "./js/ui/renderer.js",
    "./js/ui/screens.js",
    "./data/release-config.json",
    "./data/asset-manifest.json",
    "./data/content.json",
    "./data/route-alternate.json",
    "./data/routes-primary.geojson",
    "./assets/icons/icon.svg",
    "./assets/images/puzzles/q1.jpg",
    "./assets/images/puzzles/q3-morse-code.jpg",
    "./assets/images/parts/scrap_R.png",
    "./assets/images/parts/scrap_A.png",
    "./assets/images/parts/scrap_M.png",
    "./assets/images/parts/scrap_I.png"
  ],
  "optional": [
    "./assets/audio/bgm/ki.mp3",
    "./assets/audio/bgm/shou.mp3",
    "./assets/audio/bgm/ten.mp3",
    "./assets/audio/bgm/ketsu.mp3",
    "./assets/audio/bgm/ed.mp3",
    "./assets/audio/sfx/click_next.mp3",
    "./assets/audio/sfx/morsecode_HOLES.mp3",
    "./assets/audio/sfx/電話の呼び出し音.mp3",
    "./assets/audio/silence-10s.mp3",
    "./assets/audio/……聞こえる！？ よかった、通信がつながった！ その端末を拾ってくれた地球人だよね。...地球人、改めてよろしくね。.mp3",
    "./assets/audio/君たちは、この場所を「高尾山」って呼んでるんだよね。...なんだか不思議だね。.mp3",
    "./assets/audio/地球の空気って面白いね。...宇宙船の中では空気は機械で作るものだから、植物が空気を作ってくれるって、ボクにはちょっと不思議なんだ。.mp3",
    "./assets/audio/高尾について調べてたとき、面白いものを見つけたんだ。...もしかして、宇宙人より地球人のほうが想像力豊かなんじゃない？.mp3",
    "./assets/audio/水星、金星、地球、火星……地球人は惑星にいろんな名前を付けてる。...パスワードがわかれば、箱を開けられるかも.mp3"
  ]
}
